{
  "register_id": "official-source-register",
  "compiled_on": "2026-10-21",
  "verification_status_legend": {
    "fetched-and-read": "Document fetched in full and read during the build",
    "read-via-search-index": "Official document text read through a search index excerpt; full document still to be ingested",
    "snapshot-stored": "Official page downloaded and stored under data/sources/snapshots",
    "referenced-not-ingested": "Official URL confirmed by an official document; content not yet read",
    "blocked-from-build-environment": "Official domain returned a proxy error (HTTP 503 or 403) from the build environment; content not read",
    "secondary-only": "Fact currently rests on reputable secondary reporting; primary document must be attached before relying on it"
  },
  "sources": [
    {
      "source_id": "SRC-CBSE-CIRC-ACAD-14-2026",
      "title": "CBSE Circular Acad-14/2026 (01.04.2026): Release of CBSE Curriculum for Academic Session 2026-27 for Classes IX-XII",
      "issuing_body": "Central Board of Secondary Education",
      "url": "https://cbseacademic.nic.in/web_material/Circulars/2026/14_Circular_2026.pdf",
      "type": "primary-official",
      "retrieved_on": "2026-10-21",
      "verification_status": "fetched-and-read",
      "supports": [
        "Classes XI-XII curriculum released 1 April 2026, Classes IX-X on 2 April 2026",
        "CBSE implements the NCF-2023 scheme of studies in Class IX from 2026-27",
        "Curriculum documents live at cbseacademic.nic.in/curriculum_2027.html"
      ]
    },
    {
      "source_id": "SRC-CBSE-CURRICULUM-2026-27-PAGE",
      "title": "CBSE Curriculum 2026-27 tab (Secondary Part-I Class IX, Secondary Part-I Class X, Senior Secondary Part-II XI-XII)",
      "issuing_body": "Central Board of Secondary Education",
      "url": "https://cbseacademic.nic.in/curriculum_2027.html",
      "type": "primary-official",
      "retrieved_on": "2026-10-21",
      "verification_status": "blocked-from-build-environment",
      "supports": [
        "Subject-wise syllabus PDFs for Classes IX-XII (to ingest in Phase 3)"
      ]
    },
    {
      "source_id": "SRC-CBSE-CIRC-ACAD-33-2026",
      "title": "CBSE Circular Acad-33/2026 (15.05.2026): Alignment of Scheme of Studies for Languages in Classes IX and X (2026-27 onwards) with NCF-SE 2023",
      "issuing_body": "Central Board of Secondary Education",
      "url": "https://cbseacademic.nic.in/web_material/Circulars/2026/33_Circular_2026_hi.pdf",
      "type": "primary-official",
      "retrieved_on": "2026-10-21",
      "verification_status": "read-via-search-index",
      "supports": [
        "From 1 July 2026, three languages (R1, R2, R3) compulsory in Class IX, at least two native Indian languages",
        "Class IX students use Class VI R3 textbooks (2026-27 edition) until dedicated R3 books exist",
        "No Class X board exam for R3; R3 assessment school-based and internal"
      ],
      "notes": "Hindi version read via search excerpt; key clauses corroborated by multiple school circulars quoting Acad-33/2026. English version to ingest."
    },
    {
      "source_id": "SRC-CBSE-CIRC-ACAD-49-2026",
      "title": "CBSE Circular Acad-49/2026: three-language implementation details by batch (Classes VI to X, 2026-27)",
      "issuing_body": "Central Board of Secondary Education",
      "url": "https://cbseacademic.nic.in/web_material/Circulars/2026/49_Circular_2026.pdf",
      "type": "primary-official",
      "retrieved_on": "2026-10-21",
      "verification_status": "read-via-search-index",
      "supports": [
        "Separate three-language rules for Class X (2026-27), Class IX (2026-27), Classes VII-VIII (2026-27) and Class VI (2026-27) batches",
        "Two of three languages must be Bharatiya Bhashas"
      ],
      "notes": "Only fragments read. Full batch rules to ingest before Phase 2 placement logic uses them."
    },
    {
      "source_id": "SRC-CBSE-CIRC-ACAD-12-2025",
      "title": "CBSE Circular Acad-12/2025 (26.03.2025): Implementation of New Competency-Based Textbooks for Grades 4, 5, 7 and 8",
      "issuing_body": "Central Board of Secondary Education",
      "url": "https://www.cbseacademic.nic.in/web_material/Circulars/2025/12_Circular_2025.pdf",
      "type": "primary-official",
      "retrieved_on": "2026-10-21",
      "verification_status": "read-via-search-index",
      "supports": [
        "New NCERT textbooks for Grades 4, 5, 7, 8 from 2025-26",
        "Bridge programmes for Classes 5 and 8"
      ]
    },
    {
      "source_id": "SRC-CBSE-CIRC-ACAD-48-2025",
      "title": "CBSE Circular Acad-48/2025 (28.07.2025): Availability of New Textbooks and Learning Outcomes for the Foundational Stage",
      "issuing_body": "Central Board of Secondary Education",
      "url": "https://cbseacademic.nic.in/web_material/Circulars/2025/48_Circular_2025.pdf",
      "type": "primary-official",
      "retrieved_on": "2026-10-21",
      "verification_status": "read-via-search-index",
      "supports": [
        "New textbooks for Grades 5 and 8 (Santoor, Math Mela, Veena, Poorvi, Ganita Prakash, Curiosity)",
        "Links NCERT Learning Outcomes for the Foundational Stage"
      ]
    },
    {
      "source_id": "SRC-CBSE-PRIVATE-CANDIDATE-BYELAWS",
      "title": "CBSE Examination Bye-laws: Private Candidates (archive)",
      "issuing_body": "Central Board of Secondary Education",
      "url": "https://cbse.gov.in/cbsenew/Exambylaws_archive/Private Candidates.pdf",
      "type": "primary-official",
      "retrieved_on": "2026-10-21",
      "verification_status": "read-via-search-index",
      "supports": [
        "Private candidature limited to defined categories (for example candidates who failed a previous Board exam, and specified categories of NCT Delhi residents)"
      ],
      "notes": "Archive copy. Current bye-laws to be confirmed; corroborated by Delhi High Court LPA 113/2025 citing amended bye-law 17(i)."
    },
    {
      "source_id": "SRC-DELHI-HC-LPA-113-2025",
      "title": "Delhi High Court judgment in LPA 113/2025 applying CBSE bye-law 17(i) on private candidates",
      "issuing_body": "High Court of Delhi",
      "url": "https://delhihighcourt.nic.in/app/showFileJudgment/68314022025LPA1132025_180620.pdf",
      "type": "primary-official",
      "retrieved_on": "2026-10-21",
      "verification_status": "read-via-search-index",
      "supports": [
        "Under amended bye-law 17(i), a candidate who failed may re-appear only as a private candidate"
      ]
    },
    {
      "source_id": "SRC-NCERT-TEXTBOOK-INDEX",
      "title": "NCERT e-textbook index (class, subject, book dropdowns)",
      "issuing_body": "National Council of Educational Research and Training",
      "url": "https://ncert.nic.in/textbook.php",
      "type": "primary-official",
      "retrieved_on": "2026-10-21",
      "verification_status": "snapshot-stored",
      "supports": [
        "Textbook titles per class and subject for Classes 1-12"
      ],
      "notes": "Snapshot: data/sources/snapshots/ncert-textbook-index-snapshot-2026-10-21.html. Derived: data/sources/derived/ncert-textbook-titles-by-class-2026-10-21.json"
    },
    {
      "source_id": "SRC-NCERT-PRICE-LIST-2025",
      "title": "NCERT textbook rate list 2025 (Classes 1-12)",
      "issuing_body": "National Council of Educational Research and Training",
      "url": "https://ncertbooks.ncert.gov.in/static/Latest rate 2025.xlsx.pdf",
      "type": "primary-official",
      "retrieved_on": "2026-10-21",
      "verification_status": "read-via-search-index",
      "supports": [
        "Current-series titles: Sarangi, Mridang, Joyful Mathematics (1-2); Veena, Santoor, Maths Mela, Our Wondrous World, Bansuri (3-5); Poorvi, Ganita Prakash, Curiosity (6-8)"
      ]
    },
    {
      "source_id": "SRC-NCERT-LO-FOUNDATIONAL",
      "title": "NCERT Learning Outcomes for the Foundational Stage",
      "issuing_body": "National Council of Educational Research and Training",
      "url": "https://ncert.nic.in/pdf/publication/otherpublications/Learning_Outcome_for_the_Foundational_Stage.pdf",
      "type": "primary-official",
      "retrieved_on": "2026-10-21",
      "verification_status": "referenced-not-ingested",
      "supports": [
        "Foundational-stage learning outcomes (to ingest in Phase 3)"
      ]
    },
    {
      "source_id": "SRC-MOE-DOSEL-ECCE-LETTER",
      "title": "Ministry of Education (DoSEL) and Ministry of Women and Child Development joint communication on ECCE, Aadharshila, Navchetana and Jaadui Pitara",
      "issuing_body": "Ministry of Education, Department of School Education and Literacy",
      "url": "https://dsel.education.gov.in/sites/default/files/update/do_ecce.pdf",
      "type": "primary-official",
      "retrieved_on": "2026-10-21",
      "verification_status": "read-via-search-index",
      "supports": [
        "Foundational stage = 3 years of preschool (ages 3-6) + Grades 1-2 (ages 6-8)",
        "NCF-FS is the basis for Jaadui Pitara (DoSEL) and Aadharshila (MWCD)"
      ]
    },
    {
      "source_id": "SRC-RS-UQ319-2024-07-24",
      "title": "Rajya Sabha Unstarred Question 319 answered 24.07.2024, Ministry of Women and Child Development",
      "issuing_body": "Parliament of India (Rajya Sabha) / Ministry of Women and Child Development",
      "url": "https://rsdebate.nic.in/bitstream/123456789/749295/1/PQ_265_24072024_U319_p565_p566.pdf",
      "type": "primary-official",
      "retrieved_on": "2026-10-21",
      "verification_status": "read-via-search-index",
      "supports": [
        "Navchetana: National Framework for Early Childhood Stimulation for Children from Birth to Three Years, 2024",
        "Aadharshila: National Curriculum for ECCE for Children from Three to Six Years, 2024",
        "Both under the Poshan Bhi Padhai Bhi programme"
      ]
    },
    {
      "source_id": "SRC-PIB-POSHAN-BHI-PADHAI-BHI",